{
  "cache_status": "current",
  "components": [
    [
      "/concepts/bm25-search.md",
      "/concepts/compiled-knowledge.md",
      "/concepts/context-contamination.md",
      "/concepts/frontmatter.md",
      "/concepts/hybrid-search.md",
      "/concepts/llm-wiki.md",
      "/concepts/open-knowledge-format.md",
      "/concepts/progressive-disclosure.md",
      "/concepts/reciprocal-rank-fusion.md",
      "/concepts/retrieval-augmented-generation.md",
      "/concepts/source-immutability.md",
      "/concepts/vector-search.md",
      "/concepts/wiki-drift.md",
      "/decisions/adopt-local-profile-over-minimal-okf.md",
      "/decisions/use-okf-compatible-markdown-links.md",
      "/index.md",
      "/log.md",
      "/methods/graph-routing.md",
      "/methods/source-ingestion.md",
      "/methods/wiki-linting.md",
      "/overview.md",
      "/references/2026-07-09-llm-wiki-system-instructions.md",
      "/references/2026-07-13-llm-wiki-system-instructions.md",
      "/syntheses/llm-wiki-operating-model.md",
      "/syntheses/llm-wiki-vs-rag.md",
      "/tools/query-cli.md",
      "/tools/sqlite-fts5.md"
    ]
  ],
  "degree": {
    "/concepts/bm25-search.md": {
      "in": 6,
      "in_non_reserved": 5,
      "out": 4
    },
    "/concepts/compiled-knowledge.md": {
      "in": 9,
      "in_non_reserved": 8,
      "out": 7
    },
    "/concepts/context-contamination.md": {
      "in": 5,
      "in_non_reserved": 4,
      "out": 6
    },
    "/concepts/frontmatter.md": {
      "in": 3,
      "in_non_reserved": 2,
      "out": 4
    },
    "/concepts/hybrid-search.md": {
      "in": 11,
      "in_non_reserved": 10,
      "out": 6
    },
    "/concepts/llm-wiki.md": {
      "in": 12,
      "in_non_reserved": 11,
      "out": 7
    },
    "/concepts/open-knowledge-format.md": {
      "in": 6,
      "in_non_reserved": 5,
      "out": 5
    },
    "/concepts/progressive-disclosure.md": {
      "in": 12,
      "in_non_reserved": 11,
      "out": 6
    },
    "/concepts/reciprocal-rank-fusion.md": {
      "in": 2,
      "in_non_reserved": 1,
      "out": 5
    },
    "/concepts/retrieval-augmented-generation.md": {
      "in": 4,
      "in_non_reserved": 3,
      "out": 7
    },
    "/concepts/source-immutability.md": {
      "in": 6,
      "in_non_reserved": 5,
      "out": 5
    },
    "/concepts/vector-search.md": {
      "in": 5,
      "in_non_reserved": 4,
      "out": 3
    },
    "/concepts/wiki-drift.md": {
      "in": 5,
      "in_non_reserved": 4,
      "out": 5
    },
    "/decisions/adopt-local-profile-over-minimal-okf.md": {
      "in": 4,
      "in_non_reserved": 3,
      "out": 3
    },
    "/decisions/use-okf-compatible-markdown-links.md": {
      "in": 5,
      "in_non_reserved": 4,
      "out": 3
    },
    "/index.md": {
      "in": 0,
      "in_non_reserved": 0,
      "out": 25
    },
    "/log.md": {
      "in": 0,
      "in_non_reserved": 0,
      "out": 2
    },
    "/methods/graph-routing.md": {
      "in": 10,
      "in_non_reserved": 9,
      "out": 3
    },
    "/methods/source-ingestion.md": {
      "in": 8,
      "in_non_reserved": 7,
      "out": 4
    },
    "/methods/wiki-linting.md": {
      "in": 7,
      "in_non_reserved": 6,
      "out": 3
    },
    "/overview.md": {
      "in": 3,
      "in_non_reserved": 2,
      "out": 10
    },
    "/references/2026-07-09-llm-wiki-system-instructions.md": {
      "in": 3,
      "in_non_reserved": 1,
      "out": 16
    },
    "/references/2026-07-13-llm-wiki-system-instructions.md": {
      "in": 26,
      "in_non_reserved": 24,
      "out": 15
    },
    "/syntheses/llm-wiki-operating-model.md": {
      "in": 6,
      "in_non_reserved": 5,
      "out": 8
    },
    "/syntheses/llm-wiki-vs-rag.md": {
      "in": 5,
      "in_non_reserved": 4,
      "out": 7
    },
    "/tools/query-cli.md": {
      "in": 11,
      "in_non_reserved": 10,
      "out": 4
    },
    "/tools/sqlite-fts5.md": {
      "in": 3,
      "in_non_reserved": 2,
      "out": 4
    }
  },
  "edges": [
    {
      "source": "/concepts/bm25-search.md",
      "target": "/concepts/hybrid-search.md"
    },
    {
      "source": "/concepts/bm25-search.md",
      "target": "/concepts/vector-search.md"
    },
    {
      "source": "/concepts/bm25-search.md",
      "target": "/references/2026-07-13-llm-wiki-system-instructions.md"
    },
    {
      "source": "/concepts/bm25-search.md",
      "target": "/tools/sqlite-fts5.md"
    },
    {
      "source": "/concepts/compiled-knowledge.md",
      "target": "/concepts/llm-wiki.md"
    },
    {
      "source": "/concepts/compiled-knowledge.md",
      "target": "/concepts/retrieval-augmented-generation.md"
    },
    {
      "source": "/concepts/compiled-knowledge.md",
      "target": "/concepts/wiki-drift.md"
    },
    {
      "source": "/concepts/compiled-knowledge.md",
      "target": "/methods/source-ingestion.md"
    },
    {
      "source": "/concepts/compiled-knowledge.md",
      "target": "/references/2026-07-13-llm-wiki-system-instructions.md"
    },
    {
      "source": "/concepts/compiled-knowledge.md",
      "target": "/syntheses/llm-wiki-operating-model.md"
    },
    {
      "source": "/concepts/compiled-knowledge.md",
      "target": "/syntheses/llm-wiki-vs-rag.md"
    },
    {
      "source": "/concepts/context-contamination.md",
      "target": "/concepts/hybrid-search.md"
    },
    {
      "source": "/concepts/context-contamination.md",
      "target": "/concepts/llm-wiki.md"
    },
    {
      "source": "/concepts/context-contamination.md",
      "target": "/concepts/progressive-disclosure.md"
    },
    {
      "source": "/concepts/context-contamination.md",
      "target": "/concepts/wiki-drift.md"
    },
    {
      "source": "/concepts/context-contamination.md",
      "target": "/methods/graph-routing.md"
    },
    {
      "source": "/concepts/context-contamination.md",
      "target": "/references/2026-07-13-llm-wiki-system-instructions.md"
    },
    {
      "source": "/concepts/frontmatter.md",
      "target": "/concepts/open-knowledge-format.md"
    },
    {
      "source": "/concepts/frontmatter.md",
      "target": "/concepts/progressive-disclosure.md"
    },
    {
      "source": "/concepts/frontmatter.md",
      "target": "/references/2026-07-13-llm-wiki-system-instructions.md"
    },
    {
      "source": "/concepts/frontmatter.md",
      "target": "/tools/query-cli.md"
    },
    {
      "source": "/concepts/hybrid-search.md",
      "target": "/concepts/bm25-search.md"
    },
    {
      "source": "/concepts/hybrid-search.md",
      "target": "/concepts/progressive-disclosure.md"
    },
    {
      "source": "/concepts/hybrid-search.md",
      "target": "/concepts/reciprocal-rank-fusion.md"
    },
    {
      "source": "/concepts/hybrid-search.md",
      "target": "/concepts/vector-search.md"
    },
    {
      "source": "/concepts/hybrid-search.md",
      "target": "/methods/graph-routing.md"
    },
    {
      "source": "/concepts/hybrid-search.md",
      "target": "/references/2026-07-13-llm-wiki-system-instructions.md"
    },
    {
      "source": "/concepts/llm-wiki.md",
      "target": "/concepts/compiled-knowledge.md"
    },
    {
      "source": "/concepts/llm-wiki.md",
      "target": "/concepts/open-knowledge-format.md"
    },
    {
      "source": "/concepts/llm-wiki.md",
      "target": "/concepts/progressive-disclosure.md"
    },
    {
      "source": "/concepts/llm-wiki.md",
      "target": "/concepts/retrieval-augmented-generation.md"
    },
    {
      "source": "/concepts/llm-wiki.md",
      "target": "/concepts/source-immutability.md"
    },
    {
      "source": "/concepts/llm-wiki.md",
      "target": "/methods/wiki-linting.md"
    },
    {
      "source": "/concepts/llm-wiki.md",
      "target": "/references/2026-07-13-llm-wiki-system-instructions.md"
    },
    {
      "source": "/concepts/open-knowledge-format.md",
      "target": "/concepts/frontmatter.md"
    },
    {
      "source": "/concepts/open-knowledge-format.md",
      "target": "/concepts/llm-wiki.md"
    },
    {
      "source": "/concepts/open-knowledge-format.md",
      "target": "/decisions/adopt-local-profile-over-minimal-okf.md"
    },
    {
      "source": "/concepts/open-knowledge-format.md",
      "target": "/decisions/use-okf-compatible-markdown-links.md"
    },
    {
      "source": "/concepts/open-knowledge-format.md",
      "target": "/references/2026-07-13-llm-wiki-system-instructions.md"
    },
    {
      "source": "/concepts/progressive-disclosure.md",
      "target": "/concepts/context-contamination.md"
    },
    {
      "source": "/concepts/progressive-disclosure.md",
      "target": "/concepts/frontmatter.md"
    },
    {
      "source": "/concepts/progressive-disclosure.md",
      "target": "/concepts/hybrid-search.md"
    },
    {
      "source": "/concepts/progressive-disclosure.md",
      "target": "/methods/graph-routing.md"
    },
    {
      "source": "/concepts/progressive-disclosure.md",
      "target": "/references/2026-07-13-llm-wiki-system-instructions.md"
    },
    {
      "source": "/concepts/progressive-disclosure.md",
      "target": "/syntheses/llm-wiki-operating-model.md"
    },
    {
      "source": "/concepts/reciprocal-rank-fusion.md",
      "target": "/concepts/bm25-search.md"
    },
    {
      "source": "/concepts/reciprocal-rank-fusion.md",
      "target": "/concepts/hybrid-search.md"
    },
    {
      "source": "/concepts/reciprocal-rank-fusion.md",
      "target": "/concepts/vector-search.md"
    },
    {
      "source": "/concepts/reciprocal-rank-fusion.md",
      "target": "/references/2026-07-13-llm-wiki-system-instructions.md"
    },
    {
      "source": "/concepts/reciprocal-rank-fusion.md",
      "target": "/tools/query-cli.md"
    },
    {
      "source": "/concepts/retrieval-augmented-generation.md",
      "target": "/concepts/bm25-search.md"
    },
    {
      "source": "/concepts/retrieval-augmented-generation.md",